Title	Designation	Points	Price	Appellation	TasterName	TasterTwitterHandle	TasterTitle	Variety	Winery	DatePublished	Category	BottleSize	Alcohol	Description
Ebner-Ebenauer 2015 Black Edition Pinot Noir (Niederösterreich)	Black Edition	93	N/A	Niederösterreich, Austria	Anne Krebiehl MW	@AnneInVino	Contributing Editor	Pinot Noir	Ebner-Ebenauer	7/1/2019	Red	750 ml	13%	A hint of smoky dill segues into a pure note of aromatic red cherry. The palate presents pristine red fruit, translucent and tender, surrounded by smoky, scented oak. This needs time to integrate but shows lovely freshness and ripeness captured at the right moment. This is an elegant, warm and tender Pinot with lots of purity and freshness. Drink 2020–2030.
Neumeister 2017 Ried Klausen Sauvignon Blanc (Vulkanland Steiermark)	Ried Klausen	93	$38	Vulkanland Steiermark, Austria	Anne Krebiehl MW	@AnneInVino	Contributing Editor	Sauvignon Blanc	Neumeister	7/1/2019	White	750 ml	13%	Zesty citrus on the nose has a tiny edge of reductive smoke. The palate brims with the vigorous and vibrant varietal freshness but this is set against a cloud-like impression of peach, grape and passion fruit juiciness. Despite the slenderness, this is a huge mouthful of flavor, zestiness and utter freshness. Lovely now, and it is certain to evolve. Drink 2020–2030.
Domaine Drouhin Oregon 2015 Laurène Pinot Noir (Dundee Hills)	Laurène	93	$70	Dundee Hills, Willamette Valley, Oregon, US	Paul Gregutt	@paulgwine	Contributing Editor	Pinot Noir	Domaine Drouhin Oregon	7/1/2019	Red	750 ml	14.1%	Thick with ripe black fruits that are streaked with cola, this substantial vintage of the winery's middle-tier bottling also brings notes of toasted hazelnuts. The overall balance is spot-on, with ample acidity lending a suggestion of wet stone as the flavors resolve into the finish. Delicious already but quite ageworthy for a decade at least.
Hoi Polloi 2016 Double Exposure Syrah (Central Coast)	Double Exposure	93	$54	Central Coast, Central Coast, California, US	Matt Kettmann	@mattkettmann	Contributing Editor	Syrah	Hoi Polloi	7/1/2019	Red	750 ml	15.1%	Roasted blackberries, smoke, milk chocolate and an array of underlying herbs show on the nose of this blend of fruit from the Sta. Rita Hills, Ballard Canyon and Adelaida District. The palate offers roasted flavors against a fresh boysenberry backdrop, with a firm tannic edge and buoyant alcohol levels that will enable long aging. Drink now through 2030.
Ebner-Ebenauer 2017 Sauberg Grüner Veltliner (Niederösterreich)	Sauberg	93	N/A	Niederösterreich, Austria	Anne Krebiehl MW	@AnneInVino	Contributing Editor	Grüner Veltliner	Ebner-Ebenauer	7/1/2019	White	750 ml	13%	Something inherently juicy entices on the nose. Ripe mirabelle plum beckons from the go. This is cushioned and rounded, juicy and generous, but at its centre, that fine bright lemony pepperiness shines through while fine yeastiness makes this extra creamy.
Ovum 2017 Off the Grid Riesling (Rogue Valley)	Off the Grid	93	$27	Rogue Valley, Southern Oregon, Oregon, US	Paul Gregutt	@paulgwine	Contributing Editor	Riesling	Ovum	7/1/2019	White	750 ml	13.5%	Off the grid, indeed! The grapes come from the Cedar Ranch Vineyard in the Illinois Valley (near the California border in southwest Oregon), and were fermented with native yeast in a concrete egg. It's a strikingly intense wine with tangy tangerine, peach and pear fruit concentrated to a fine focus. The details, texture and underlying minerality push this to the top tier of Oregon's (and Ovum's) Rieslings.
Challen 2015 Jasper Pinot Noir (Santa Maria Valley)	Jasper	93	$85	Santa Maria Valley, Central Coast, California, US	Matt Kettmann	@mattkettmann	Contributing Editor	Pinot Noir	Challen	7/1/2019	Red	750 ml	14.2%	A very full aromatic experience, this bottling offers mulberry, Luxardo cherry, clove, sarsaparilla and cardamom cream on the nose. The palate offers rich and dark fruit flavors, but it's the Indian-like spices of chai and masala that dominate and make for a memorable sip.
Castelnau 2006 Millésimé Brut (Champagne)	Millésimé Brut	93	$79	Champagne, Champagne, France	Roger Voss	@vossroger	European Editor, Reviews wines from Portugal and France	Champagne Blend, Sparkling	Castelnau	7/1/2019	Sparkling	750 ml	12.5%	A blend dominated by Chardonnay and aged for 11 years on lees has produced a mature, toasty and yeasty wine with a complex balance between the secondary flavors and the still-crisp apple fruits. Drink now.
Kutch 2017 Chardonnay (Sonoma Coast)	null	93	$42	Sonoma Coast, Sonoma, California, US	Virginie Boone	@vboone	Contributing Editor	Chardonnay	Kutch	7/1/2019	White	750 ml	12.25%	From older plantings on the extreme Sonoma Coast, this is a high-toned, linear and freshly focused wine with an Old World sensibility, light in ripeness and delicate in texture. Floral aromatics lead to a palate of Meyer lemon, sea spray and white flowers, finishing in a twist of grapefruit.
Jorge Ordóñez & Co. 2016 Victoria 2 Muscatel (Málaga)	Victoria 2	93	$26	Málaga, Andalucia, Spain	Michael Schachner	@wineschach	Spanish and South American Editor	Muscatel, Muscat	Jorge Ordóñez & Co.	7/1/2019	Dessert	375 ml	10%	A mixed tropical-fruit aroma is pure and clean on the nose. On the palate, this Moscatel is smooth and creamy, but with fine acidity to balance. Mango, honey and pineapple flavors slide away with grace on a lush yet nicely balanced finish. Drink through 2025.
Refugio Ranch 2016 Syrah (Santa Ynez Valley)	null	93	$40	Santa Ynez Valley, Central Coast, California, US	Matt Kettmann	@mattkettmann	Contributing Editor	Syrah	Refugio Ranch	7/1/2019	Red	750 ml	15%	There's a cooler climate funk to this bottling, which is grown on the shady north side of the Santa Ynez River. Aromas of roasted meats, lavender, elderberry and tar lead into a palate of espresso bean, black plum and lilac. The finish combines tobacco and lavender.
The Calling 2017 Chardonnay (Sonoma Coast)	null	93	$32	Sonoma Coast, Sonoma, California, US	Virginie Boone	@vboone	Contributing Editor	Chardonnay	The Calling	7/1/2019	White	750 ml	14.1%	This is a remarkably balanced white that is steely in nature, with bright aromas of tangerine, grapefruit and Meyer lemon. These tones follow through on the palate, alongside a fleshy texture and mineral stoniness that refreshes and lingers.
Two Sisters 2016 Lindsay's Vineyard Pinot Noir (Sta. Rita Hills)	Lindsay's Vineyard	93	$75	Sta. Rita Hills, Central Coast, California, US	Matt Kettmann	@mattkettmann	Contributing Editor	Pinot Noir	Two Sisters	7/1/2019	Red	750 ml	14.3%	Aromas of rose petal, mulberry and violet make for an intriguing entry to this bottling. It's a smooth style of Pinot Noir, with soft tannins and a rich mouthfeel that carries flavors of violet and boysenberry.
Ebner-Ebenauer 2017 Alte Reben Weissburgunder (Niederösterreich)	Alte Reben	93	N/A	Niederösterreich, Austria	Anne Krebiehl MW	@AnneInVino	Contributing Editor	Weissburgunder, Pinot Blanc	Ebner-Ebenauer	7/1/2019	White	750 ml	13%	Subtle mirabelle plum notes on the nose are inflected with ripe Amalfi lemon highlights. The palate continues the lemon precision and purity with wonderful concentration and poise, all the while presenting juicy ripe plum fruit. Well-judged creaminess adds texture. This is seductive now, but bottle age will reveal the true depth of fruit and freshness that are captured here. Drink 2020–2030.
Santa Carolina 2014 VSC Red (Cachapoal Valley)	VSC	93	$50	Cachapoal Valley, Chile	Michael Schachner	@wineschach	Spanish and South American Editor	Red Blends	Santa Carolina	7/1/2019	Red	750 ml	14.5%	Despite a saturated black color and deep aromas of raisin, fig and chocolate that push the level of acceptable ripeness to the hilt, this is a delicious multigrape blend to drink now. A fleshy, voluminous palate holds ripe flavors of blackberry, black plum and prune. Coffee and chocolate flavors are more than background notes on a smooth finish with silky tannins.
Pali 2016 Cargasacchi Vineyard Pinot Noir (Sta. Rita Hills)	Cargasacchi Vineyard	93	$75	Sta. Rita Hills, Central Coast, California, US	Matt Kettmann	@mattkettmann	Contributing Editor	Pinot Noir	Pali	7/1/2019	Red	750 ml	14.8%	Plump red-cherry and red-currant aromas are sprinkled with wet gravel, chaparral herbs and pepper spice on the nose of this bottling. The palate is full of stewed red-plum and broiled cherry flavors, yet the herbal components play loudest, with oregano, marjoram and thyme all taking part.
Patricia Green Cellars 2017 Olenik Vineyard Anklebreaker Block Pinot Noir (Chehalem Mountains)	Olenik Vineyard Anklebreaker Block	93	$60	Chehalem Mountains, Willamette Valley, Oregon, US	Paul Gregutt	@paulgwine	Contributing Editor	Pinot Noir	Patricia Green Cellars	7/1/2019	Red	750 ml	14%	Gotta love the name, which the winery notes attribute to its “unusually rocky topsoil.” Spicy and sharp edged, it explodes with pungent cranberry and raspberry fruit. Then, with a little airing out, the flavors broaden across the midpalate, textural and bracing. The mineral-drenched finish lingers for a full minute or longer.
Pali 2016 Fiddlestix Vineyard Pinot Noir (Sta. Rita Hills)	Fiddlestix Vineyard	93	$69	Sta. Rita Hills, Central Coast, California, US	Matt Kettmann	@mattkettmann	Contributing Editor	Pinot Noir	Pali	7/1/2019	Red	750 ml	14.8%	Heavy aromas of black cherry, root beer, purple flowers and crushed clove show on the nose of this rich yet complex bottling from a vineyard planted in 1998. The intensity continues on the palate, where black cherry and chai spices make for a powerful experience.
Sculpterra 2016 Grenache (Paso Robles)	null	93	$32	Paso Robles, Central Coast, California, US	Matt Kettmann	@mattkettmann	Contributing Editor	Grenache	Sculpterra	7/1/2019	Red	750 ml	14%	This twist-top bottling is an easy, fun and very likable wine, starting with fresh aromas of sour cherry, gravelly minerality, wild thyme and dried sagebrush. Ripe red plums and strawberries make for a lush palate yet it's restrained with a chalky streak.
Lange 2017 Freedom Hill Vineyard Chardonnay (Willamette Valley)	Freedom Hill Vineyard	93	$65	Willamette Valley, Willamette Valley, Oregon, US	Paul Gregutt	@paulgwine	Contributing Editor	Chardonnay	Lange	7/1/2019	White	750 ml	13.4%	A mix of tree fruits laced with an impression of pea vine, this lovely, textural wine shows impeccable balance throughout a long finish. Hints of fresh herb combine with a deeply fruity palate in keeping with the house style and the vineyard's characteristic stamp.
Kutch 2017 McDougall Ranch Pinot Noir (Sonoma Coast)	McDougall Ranch	93	$64	Sonoma Coast, Sonoma, California, US	Virginie Boone	@vboone	Contributing Editor	Pinot Noir	Kutch	7/1/2019	Red	750 ml	13%	Perfumed in rose and lavender, this is an earthy, balanced and brightly light vineyard-designate that shows savory earthiness and lifted acidity. Wild strawberry and rhubarb give it a touch of fruit.
Beauregard 2016 Coast Grade Vineyard Pinot Noir (Ben Lomond Mountain)	Coast Grade Vineyard	93	$60	Ben Lomond Mountain, Central Coast, California, US	Matt Kettmann	@mattkettmann	Contributing Editor	Pinot Noir	Beauregard	7/1/2019	Red	750 ml	12.4%	This bottling from a coastal vineyard planted in 2008 is fresh and bursting on the nose with raspberry, dark red-currant, roasted oak and sagebrush aromas. There's a wide herbal array to the palate, from marjoram to bay leaf, set against a raspberry, pomegranate and hibiscus backdrop. Drink now through 2036.
Patricia Green Cellars 2017 Freedom Hill Vineyard Wadensvil Clone Pinot Noir (Willamette Valley)	Freedom Hill Vineyard Wadensvil Clone	93	$42	Willamette Valley, Willamette Valley, Oregon, US	Paul Gregutt	@paulgwine	Contributing Editor	Pinot Noir	Patricia Green Cellars	7/1/2019	Red	750 ml	14%	Among no fewer than five Freedom Hill cuvées from Patricia Green in 2017, this pokes out just a bit richer and fuller than the others, with brambly black cherry fruit and savory herbs. The tannins taste of black tea, and as the wine takes a deep dive down the palate, streaks of cola bring additional highlights. Quite young, but with superb long-term potential.
Viña Mayor 2015 El Secreto (Ribera del Duero)	El Secreto	93	$18	Ribera del Duero, Northern Spain, Spain	Michael Schachner	@wineschach	Spanish and South American Editor	Tempranillo	Viña Mayor	7/1/2019	Red	750 ml	14%	Aromas of blueberry, blackberry and oaky cinnamon set up a powerful palate that doesn't shy away from anything. Black fruit flavors are rugged and hold the oak well, while this is huge on the finish but forgiving due to great overall balance. Drink through 2028.
Pali 2016 Radian Vineyard Pinot Noir (Sta. Rita Hills)	Radian Vineyard	93	$60	Sta. Rita Hills, Central Coast, California, US	Matt Kettmann	@mattkettmann	Contributing Editor	Pinot Noir	Pali	7/1/2019	Red	750 ml	14.8%	Quite dark in the glass, this bottling from an epic vineyard on the southwestern edge of the appellation shows aromas of cola, boysenberry, sarsaparilla and loamy earth. It's rich on the palate with boysenberry jam, star anise and clove flavors, proving full and spicy at once.
Wohlmuth 2018 Sauvignon Blanc (Südsteiermark)	null	93	$22	Südsteiermark, Austria	Anne Krebiehl MW	@AnneInVino	Contributing Editor	Sauvignon Blanc	Wohlmuth	7/1/2019	White	750 ml	12.5%	Vivid notes of passion fruit and peach are creamy and juicy at once on the inviting nose. The palate cuts this with precise lime zest freshness that highlights the rich intense fruit even more. This very concentrated and you wonder how so much intensity can be crammed into such a slender wine. Whoa.
Château d'Aqueria 2018 Tavel	null	93	$22	Tavel, Rhône Valley, France	Anna Lee C. Iijima		Contributing Editor	Rosé	Château d'Aqueria	7/1/2019	Rose	750 ml	13.5%	This medium-bodied, dry rosé offers intensely fresh, concentrated strawberry, raspberry and watermelon flavors. It's juicy yet invigorating and mineral. A blend of Grenache, Clairette, Cinsault and Mourvèdre, it's a structured, penetrating wine that will gain depth and complexity through 2022 and serve well in the colder months with game or poultry.
Caves Velhas 2016 Cabeça de Toiro Reserva Red (Tejo)	Cabeça de Toiro Reserva	92	$17	Tejo, Portugal	Roger Voss	@vossroger	European Editor, Reviews wines from Portugal and France	Portuguese Red	Caves Velhas	7/1/2019	Red	750 ml	13.5%	A big, bold and juicy wine, this is rich with both tannins and black fruits. It is generous with its black-plum flavors, balanced acidity and a spice aftertaste from the wood aging. Drink the wine now.
Valli 2016 Waitaki Vineyard Pinot Noir (Central Otago)	Waitaki Vineyard	93	$50	Central Otago, New Zealand	Christina Pickard	@winewchristina	Contributing Editor	Pinot Noir	Valli	7/1/2019	Red	750 ml	13.5%	Grant Taylor is passionate about the limestone littered Waitaki Valley, a new wine region west of Otago, and this wine makes it easy to see why. The cooler region and season make for a fragrant nose that's hard to resist—full of bright red-berry fruit, stalks, Middle Eastern spices, a damp earth undertone and a savory streak. The nose may be heady but the palate is on terra firma, structured and elegant and wound neatly by fine savory tannins, laser sharp acidity and an endlessly long spicy finish. Sip with a Moroccan tagine. Drink now through 2027.
Kelley Fox 2016 Maresh Vineyard Pinot Noir (Dundee Hills)	Maresh Vineyard	93	$65	Dundee Hills, Willamette Valley, Oregon, US	Paul Gregutt	@paulgwine	Contributing Editor	Pinot Noir	Kelley Fox	7/1/2019	Red	750 ml	13%	Intensely aromatic, this lovely wine mixes sweet berry and black cherry in a firm, well-structured wine with a hint of pine needle running along its spine. As with all Kelley Fox wines, it's both elegant and powerful, with excellent aging potential. It will drink well now through the 2020s and likely beyond.
Peter Franus 2017 Albariño (Napa Valley)	null	93	$28	Napa Valley, Napa, California, US	Virginie Boone	@vboone	Contributing Editor	Albariño	Peter Franus	7/1/2019	White	750 ml	13.5%	This is an exceptional white, crisp and high in acidity that lingers in thirst-quenching brightness and energy. Lemon peel, lime and wet stone flavors wrap around gorgeous aromatics of star anise and jasmine, offering just the right amount of ripeness and body.
Bodega Carmen Rodríguez 2014 Carodorum Selección Especial Reserva (Toro)	Carodorum Selección Especial Reserva	92	$102	Toro, Northern Spain, Spain	Michael Schachner	@wineschach	Spanish and South American Editor	Tempranillo	Bodega Carmen Rodríguez	7/1/2019	Red	750 ml	15%	Jammy berry aromas smell like fig paste, and overall the nose on this Toro is thick and potent. Following the nose, this feels massive and deep, with hard tannins creating roughness and dryness. An explosion of black fruit flavors includes cassis and blackberry, while a big finish is sturdy, with toasty chocolaty flavors. Drink through 2030.
Central Coast Group Project 2013 Hey, Ruben? Syrah (Ballard Canyon)	Hey, Ruben?	93	$84	Ballard Canyon, Central Coast, California, US	Matt Kettmann	@mattkettmann	Contributing Editor	Syrah	Central Coast Group Project	7/1/2019	Red	750 ml	15.7%	Scott Sampler requested that viticulturalist Ruben Solorzano deliver a Syrah-based field blend for this extended maceration bottling, which shows kirsch, new leather and rocky earth on the nose. The palate is full of rocks and earth as well as dried red fruits, much like chewing on soil with a cherry cordial chaser.
Latta 2015 Upland Vineyard Grenache (Snipes Mountain)	Upland Vineyard	93	$45	Snipes Mountain, Columbia Valley, Washington, US	Sean P. Sullivan	@wawinereport	Contributing Editor	Grenache	Latta	7/1/2019	Red	750 ml	14.1%	The aromas of this 100% varietal leap up with compelling notes of kirsch, plum, pomegranate, strawberry, white pepper and herb. The palate brings a beautiful sense of texture, layering and richness, followed by a hyper-extended finish. It's a knee-buckler.
Velvet Bee 2015 Rita's Crown Vineyard Chardonnay (Sta. Rita Hills)	Rita's Crown Vineyard	93	$28	Sta. Rita Hills, Central Coast, California, US	Matt Kettmann	@mattkettmann	Contributing Editor	Chardonnay	Velvet Bee	7/1/2019	White	750 ml	14.78%	Toasted oak, white peach, fresh lilies, salted nuts and butterscotch aromas make for a very lush creamy nose on this bottling. The nutty buttery richness of the palate is sliced by vibrant citrus flavors, finishing on caramel candy.
Kutch 2017 Pinot Noir (Sonoma Coast)	null	93	$45	Sonoma Coast, Sonoma, California, US	Virginie Boone	@vboone	Contributing Editor	Pinot Noir	Kutch	7/1/2019	Red	750 ml	12.5%	This is a selection of the best barrels from several vineyard designates—a well-blended expression of their collective sense of floral earthiness. Cardamon, bergamot orange, rose and tea ride along a seamless texture of firm tannin structure and grit.
Alheit 2017 Radio Lazarus Chenin Blanc (Stellenbosch)	Radio Lazarus	93	$100	Stellenbosch, South Africa	Lauren Buzzeo	@laurbuzz	Managing Editor	Chenin Blanc	Alheit	7/1/2019	White	750 ml	13%	This is very likely the last release of this single-vineyard wine, after winemakers Chris and Suzaan Alheit found the extreme Bottelary site unrecoverable after three years of drought pushed it over the edge. Shame, but it's a beautiful swan song, boasting pure, direct notes of calendula, beeswax, fynbos and Anjou pear from the start. The palate shows good cut, with moderate acidity and a softly pithy texture reminiscent of bitter melon, orange peel and pear. The finish lingers on a saline accent.
Château d'Esclans 2017 Garrus Rosé (Côtes de Provence)	Garrus	93	$100	Côtes de Provence, Provence, France	Roger Voss	@vossroger	European Editor, Reviews wines from Portugal and France	Rosé	Château d'Esclans	7/1/2019	Rose	750 ml	14%	This is a rich, impressive wine, with spicy flavors from wood aging that are well integrated with the ripe berry fruits. Together they give intensity, sophistication and power, making this a perfect candidate to enjoy alongside food. Drink now although the wine should age further.
Arrochela & Camizão 2017 Sem Igual Ramadas Wood White (Vinho Verde)	Sem Igual Ramadas Wood	93	$40	Vinho Verde, Portugal	Roger Voss	@vossroger	European Editor, Reviews wines from Portugal and France	Portuguese White	Arrochela & Camizão	7/1/2019	White	750 ml	13.5%	Wood aged, this wine comes from old vines grown on pergolas in the traditional Vinho Verde style. It has spice and light toast flavors that still guard the fruit of the Arinto and Azal grapes in the blend. Drink now.
DeMorgenzon 2017 Reserve Chenin Blanc (Stellenbosch)	Reserve	93	$40	Stellenbosch, South Africa	Lauren Buzzeo	@laurbuzz	Managing Editor	Chenin Blanc	DeMorgenzon	7/1/2019	White	750 ml	14%	Aromas of lemon thyme, white tea, calendula, white melon and spiced yet snappy pear abound on the complex, earthy nose of this wine. The palate is plush and generous, filling the mouth on all sides with each sip, but is then countered by vibrant acidity and framed by soft wood tannin and citrus peel astringency to support the generous flavors. The finish is long and evolving, from wood to fruit to earth. A super tasty and well-balanced pour. Enjoy now–2029.
Domaine de Fondrèche 2016 Il Etait une Fois Red (Ventoux)	Il Etait une Fois	93	$60	Ventoux, Rhône Valley, France	Anna Lee C. Iijima		Contributing Editor	Rhône-style Red Blend	Domaine de Fondrèche	7/1/2019	Red	750 ml	14.5%	Black-plum and blackberry notes are intensely ripe but restrained by savory notes of licorice, clay and toast in this concentrated blend of old-vine Grenache, Mourvèdre and Syrah. It's intensely juicy and silken on the palate yet firmly structured by persistent tannins and a fresh lift of minerality. The finish is long and penetrating.
Gallimard Père et Fils NV Amphoressence Brut Nature (Champagne)	Amphoressence Brut Nature	92	$80	Champagne, Champagne, France	Roger Voss	@vossroger	European Editor, Reviews wines from Portugal and France	Champagne Blend, Sparkling	Gallimard Père et Fils	7/1/2019	Sparkling	750 ml	12%	Aging for six months in amphora has given this wine a rounded, slightly oxidative character. Even though it is bone dry, its aftertaste has matured quickly and lost its tight acidity. The wine is fresh while also rich and ready to drink now.
Neumeister 2017 Ried Steintal Roter Traminer (Vulkanland Steiermark)	Ried Steintal	92	$38	Vulkanland Steiermark, Austria	Anne Krebiehl MW	@AnneInVino	Contributing Editor	Roter Traminer, Other White	Neumeister	7/1/2019	White	750 ml	13.5%	Subtle rose petal and flint on the nose make for an intriguing combination. The palate majors on texture while subtle hints of Damask rose are a reminder of the Traminer nature of this wine. Concentration, freshness and balance demand that this dry wine comes with food. It is lovely now but is certain to develop. Drink 2020–2030.
Quady North 2018 GSM Rosé (Rogue Valley)	GSM	92	$17	Rogue Valley, Southern Oregon, Oregon, US	Paul Gregutt	@paulgwine	Contributing Editor	Rosé	Quady North	7/1/2019	Rose	750 ml	12.1%	Herb Quady's deft touch with rosé is exquisitely expressed among his three distinct 2018s. This bottling blends 56% Grenache, 39% Syrah and 5% Mourvèdre, all specifically planted and picked to be made as rosé. Juicy, crisp and complex, this is a sappy mix of apple, peach and apricot, dusted with cinnamon.
Le Vigne 2016 Nikiara Red (Paso Robles)	Nikiara	92	$51	Paso Robles, Central Coast, California, US	Matt Kettmann	@mattkettmann	Contributing Editor	Bordeaux-style Red Blend	Le Vigne	7/1/2019	Red	750 ml	13.6%	Lush black-raspberry and black-plum aromas combine with lava rocks, incense and shiitake mushrooms on the nose of this blend of 61% Cabernet Sauvignon, 19% Cabernet Franc, 15% Merlot and 5% Petit Verdot. That umami kick meets with black-plum sauce, white pepper, roasted meats and dried thyme sprigs on the palate.
Three Furies 2016 Constant Vengeance Pinot Noir (Sta. Rita Hills)	Constant Vengeance	92	$85	Sta. Rita Hills, Central Coast, California, US	Matt Kettmann	@mattkettmann	Contributing Editor	Pinot Noir	Three Furies	7/1/2019	Red	750 ml	14.5%	Baked black cherry, boysenberry pie, vanilla and clove make for an attention-grabbing nose on this bottling. The palate is tense with fine-grained tannins but bright with boysenberry and sagebrush flavors, making for a complex sip.
Holman Ranch 2014 Hunter's Cuvee Pinot Noir (Carmel Valley)	Hunter's Cuvee	92	$42	Carmel Valley, Central Coast, California, US	Matt Kettmann	@mattkettmann	Contributing Editor	Pinot Noir	Holman Ranch	7/1/2019	Red	750 ml	13.9%	Very light in the glass, this bottling from the ridges above Carmel Valley is very mineral driven, with aromas of rainy cement, light raspberry and crunchy cranberry fruit. It's very taut and rocky on the palate as well, where flavors of gravel and lanolin play against a tart red-currant backdrop.
Château d'Esclans 2017 Les Clans Rosé (Côtes de Provence)	Les Clans	92	$70	Côtes de Provence, Provence, France	Roger Voss	@vossroger	European Editor, Reviews wines from Portugal and France	Rosé	Château d'Esclans	7/1/2019	Rose	750 ml	14%	With an extra year of aging before release, this wine has both great fruit and a rich, spicy character. The concentration and the ripe berry flavors are smoothed by rounded tannins and given a bite from pepper flavors at the end. It's ready to drink.
Lachini 2016 Lachini Family Estate Pinot Noir (Chehalem Mountains)	Lachini Family Estate	92	$60	Chehalem Mountains, Willamette Valley, Oregon, US	Paul Gregutt	@paulgwine	Contributing Editor	Pinot Noir	Lachini	7/1/2019	Red	750 ml	13.8%	A fresh tasting mix of peppery, brambly berry fruit, with a sprinkling of oregano, this well-balanced wine may be enjoyed immediately, but should continue to improve over the next half-decade. The tannins are proportionate and add a drying hint of tea and tobacco to the finish.
