Title	Designation	Points	Price	Appellation	TasterName	TasterTwitterHandle	TasterTitle	Variety	Winery	DatePublished	Category	BottleSize	Alcohol	Description
Bellavista 2011 Vittorio Moretti Extra Brut (Franciacorta)	Vittorio Moretti Extra Brut	93	$120	Franciacorta, Lombardy, Italy	Kerin O’Keefe	@kerinokeefe	Italian Editor	Sparkling Blend, Sparkling	Bellavista	7/1/2019	Sparkling	750 ml	12.5%	Bread crust, chamomile and mature yellow stone fruit aromas mingle with whiffs of grilled herbs. The creamy, complex palate delivers ripe apricot, yellow apple and lemon zest alongside fennel seed and a hint of acacia honey. Fresh acidity brightens the rich flavors while an elegant perlage lends finesse. A hazelnut note lingers on the close.
Château Pesquié 2016 Artemia Syrah-Grenache (Ventoux)	Artemia	93	$45	Ventoux, Rhône Valley, France	Anna Lee C. Iijima		Contributing Editor	Syrah-Grenache, Rhône-style Red Blend	Château Pesquié	7/1/2019	Red	750 ml	14.5%	Artemia is Pesquié's prestige bottling sourced from Grenache and Syrah grown at high elevations and aged in 50% new oak. Ripe and opulent it juxtaposes fleshy black fruit against layers of olive, charcuterie and smoke. Concentrated yet elegant and silky, it drinks well already but should improve through 2026 and hold further.
Kelley Fox 2016 Maresh Vineyard Red Barn Blocks Pinot Noir (Dundee Hills)	Maresh Vineyard Red Barn Blocks	94	$75	Dundee Hills, Willamette Valley, Oregon, US	Paul Gregutt	@paulgwine	Contributing Editor	Pinot Noir	Kelley Fox	7/1/2019	Red	750 ml	13%	A block selection from vines planted in the early 1970s, this delicately expresses the complexity that such old soldiers are capable of when properly handled. Broadly tasting of strawberry and pie cherry fruit, this carries a touch of blood orange in the supple acidity. It lingers gracefully with gentle hints of toast and caramel.
Alain Jaume et Fils 2016 Vieux Terron Red (Châteauneuf-du-Pape)	Vieux Terron	93	$45	Châteauneuf-du-Pape, Rhône Valley, France	Anna Lee C. Iijima		Contributing Editor	Rhône-style Red Blend	Alain Jaume et Fils	7/1/2019	Red	750 ml	15%	While crisp blackberry and plum aromas are demure on the nose of this wine, they intensify and ripen on the palate. It's a bold, brawny, wine with densely concentrated, juicy black-fruit flavors. Approachably fruity, it's lifted by a crisp mineral finish and fine, feathery tannins. Drink now–2026.
The Calling 2016 Patriarch Pinot Noir (Sonoma Coast)	Patriarch	94	$70	Sonoma Coast, Sonoma, California, US	Virginie Boone	@vboone	Contributing Editor	Pinot Noir	The Calling	7/1/2019	Red	750 ml	14.5%	Bursting in energy and robust flavors of black tea and baked strawberry, this is a lush, plush and richly layered wine big in tannin and bright persistent acidity. Floral components of rose and lavender give it an inviting aromatic edge that complements the fruit.
Caliza 2016 Grenache (Paso Robles Willow Creek District)	null	93	$65	Paso Robles Willow Creek District, Central Coast, California, US	Matt Kettmann	@mattkettmann	Contributing Editor	Grenache	Caliza	7/1/2019	Red	750 ml	15.5%	Grenache is not known as the most ageworthy wine, but this bottling boasts all the bones to make it happen. Elegant aromas of boysenberry, lavender and dried red flowers lead into a tightly woven palate that combines ripe berries with gravelly minerality and stiff tannins. Drink 2020–2030.
Alheit 2017 Magnetic North Chenin Blanc (Citrusdal Mountain)	Magnetic North	94	$100	Citrusdal Mountain, South Africa	Lauren Buzzeo	@laurbuzz	Managing Editor	Chenin Blanc	Alheit	7/1/2019	White	750 ml	14%	Lemon balm, cinnamon bark, yellow field flowers, spiced orange tea, just-dried straw and lightly toasted apple skin all dance on the nose of this ethereal and superbly attractive wine. The mouthfeel is fruited and rounded yet balanced and textured all at once, with a lovely bitterness and a lick of salted butter that play against the ripe orchard and citrus fruit flavors. Lingering notes of waxy melon, orange rind and whole spice like nutmeg and allspice unfold on the long, lightly nutty finish. It's a charmer that's hard to resist, but will age well through 2030.
Lange 2016 Yamhill-Carlton Assemblage Pinot Noir (Yamhill-Carlton)	Yamhill-Carlton Assemblage	93	$70	Yamhill-Carlton, Willamette Valley, Oregon, US	Paul Gregutt	@paulgwine	Contributing Editor	Pinot Noir	Lange	7/1/2019	Red	750 ml	14.2%	This reserve level selection, sourced from Yamhill Vineyards, offers sweet black cherry fruit adorned with rich streaks of cola, caramel and espresso. These details are handled with a light touch, perfectly integrated into a seamless whole, and the finish is framed with toasty oak, one-third new.
Maison Denuzière 2015 Hermitage	null	93	$81	Hermitage, Rhône Valley, France	Anna Lee C. Iijima		Contributing Editor	Syrah	Maison Denuzière	7/1/2019	Red	750 ml	13%	The nose of this wine is initially subdued but opens to reveal intensely ripe, almost preserved notes of black plum and cherry. The product of a ripe vintage, it's a richer, more fruit-forward style of Hermitage than what's typical but maintains the appellation's brambly, granitic edges too. Drink now–2030.
Roar 2017 Soberanes Vineyard Chardonnay (Santa Lucia Highlands)	Soberanes Vineyard	93	$45	Santa Lucia Highlands, Central Coast, California, US	Matt Kettmann	@mattkettmann	Contributing Editor	Chardonnay	Roar	7/1/2019	White	750 ml	14.1%	Golden pear, browned butter and white-peach aromas are kissed by oak on the nose of this rich but balanced bottling. The creamy mouthfeel and poached apple flavors are leveled by lemon zest and a fresh tension, making the wine simultaneously lush and taut.
Rabl 2017 Ried Käferberg Alte Reben Reserve Grüner Veltliner (Kamptal)	Ried Käferberg Alte Reben Reserve	93	N/A	Kamptal, Austria	Anne Krebiehl MW	@AnneInVino	Contributing Editor	Grüner Veltliner	Rabl	7/1/2019	White	750 ml	13.5%	Earth, dandelion blossom and savory yeast combine on the nose to promise a full-flavored full-bodied wine. The palate obliges with concentrated texture and very yeasty savoriness that highlights white pepper and dried, crushed yarrow. This has a real savory mouthful, with a wonderfully dry finish.
Tardieu-Laurent 2016 Hermitage	null	93	$102	Hermitage, Rhône Valley, France	Anna Lee C. Iijima		Contributing Editor	Rhône-style Red Blend	Tardieu-Laurent	7/1/2019	Red	750 ml	13.5%	Perfumed whiffs of violet, anise and carmelized sugar lend warmth to this sultry, intensely fruity Syrah. It's moderately full and remarkably juicy in style but freshly balanced and framed by firm, persistent tannins. This ripe yet finessed expression of Hermitage is enjoyable now but should gain complexities through 2030.
Resalte 2015 Origen Crianza (Ribera del Duero)	Origen Crianza	93	$35	Ribera del Duero, Northern Spain, Spain	Michael Schachner	@wineschach	Spanish and South American Editor	Tempranillo	Resalte	7/1/2019	Red	750 ml	14.5%	This opaque big boy opens with dark fruit and crude oil aromas smeared with smoke. A deep, lush palate deals a ton of berry fruit, with flavors of blackberry, cassis and dark plum transitioning seamlessly onto a long finish graced by lemony oak. Drink through 2030.
Bodegas y Viñedos Tábula 2015 Tábula (Ribera del Duero)	Tábula	93	$45	Ribera del Duero, Northern Spain, Spain	Michael Schachner	@wineschach	Spanish and South American Editor	Tempranillo	Bodegas y Viñedos Tábula	7/1/2019	Red	750 ml	14.5%	Massive berry aromas come with no shortage of cinnamon and exotic spice notes. A grating palate with pounding tannins is like a tank not a sports car, while this tastes of blackberry, black tea, coffee and the same exotic spices that appear on the nose. Pepper and dark chocolate are the prime finishing flavors on this full-bodied Tinto Fino. Drink through 2028.
Vik 2014 Milla Cala Red (Cachapoal Valley)	Milla Cala	93	$45	Cachapoal Valley, Chile	Michael Schachner	@wineschach	Spanish and South American Editor	Red Blends	Vik	7/1/2019	Red	750 ml	14%	Ripe, spicy and elegant from the start, this Cabernet blend captures the essence of what Vik is doing in the Cachapoal Valley. Blackberry, prune, cedar, cigar tobacco and chocolate flavors are all noted, while this finishes with good clarity and body along with latent coffee, tobacco and oak flavors. Drink through 2024.
Joyce 2017 Tondre Grapefield Syrah (Santa Lucia Highlands)	Tondre Grapefield	93	$28	Santa Lucia Highlands, Central Coast, California, US	Matt Kettmann	@mattkettmann	Contributing Editor	Syrah	Joyce	7/1/2019	Red	750 ml	13.5%	Cool climate aromas of violet, cracked black peppercorns, savory roasted beef and elderberry fruits make for a very compelling entry to this bottling by Russell Joyce. The palate is zesty and loaded with pepper and purple flowers, set against a crisp boysenberry backdrop.
Peltier 2011 Schatz Family Reserve Teroldego (Lodi)	Schatz Family Reserve	93	$60	Lodi, Central Valley, California, US	Jim Gordon	@gordone_cellars	Contributing Editor	Teroldego, Italian Red	Peltier	7/1/2019	Red	750 ml	13.8%	This is a bold experiment in extended aging for a notoriously dark and dense Italian variety. The color is deep red at the rim and black within. Complex, spicy and evolved aromas are followed by ripe blackberry and dark chocolate flavors that are concentrated and lingering. While firmly tannic, the wine is not overly full bodied and maintains good balance that keeps it refreshing.
J. Dumangin Fils 2002 Cuvée Firmin Brut Nature Chardonnay (Champagne)	Cuvée Firmin Brut Nature	93	N/A	Champagne, Champagne, France	Roger Voss	@vossroger	European Editor, Reviews wines from Portugal and France	Chardonnay	J. Dumangin Fils	7/1/2019	Sparkling	750 ml	12%	This beautiful mineral-textured wine is 100% Chardonnay. Its taut texture, crisp acidity and citrus fruits contribute to a wine that, while now 17 years old, is still young and vibrant. Drink this bottling now.
Two Paddocks 2016 The First Paddock Pinot Noir (Central Otago)	The First Paddock	93	$80	Central Otago, New Zealand	Christina Pickard	@winewchristina	Contributing Editor	Pinot Noir	Two Paddocks	7/1/2019	Red	750 ml	13%	This is, hence the name, from proprietor and actor Sam Neill's first vineyard, planted in 1993. Don't let the slight barnyard funk put you off (after all, Burgundy excels at this aroma). It dissipates in glass, leaving in its wake something quite beautiful: fresh red cherries, whole bunch stalkiness, an array of florals and spice and a meaty undertone. It's silky, textured and plump-fruited, with a hearty grip of herbal savory tannins. As per usual with these wines, elegance, complexity and age-worthiness are the name of the game. Serve beside warming, gamy fare or cellar until 2027.
Beauregard 2017 Oeuf en Beton Bald Mountain Vineyard Chardonnay (Ben Lomond Mountain)	Oeuf en Beton Bald Mountain Vineyard	93	$50	Ben Lomond Mountain, Central Coast, California, US	Matt Kettmann	@mattkettmann	Contributing Editor	Chardonnay	Beauregard	7/1/2019	White	750 ml	12.5%	Aged in a concrete egg, this bright bottling offers aromas of kumquat, lemongrass and light almond on the nose. There is tremendous grip to the sip, where bright and brilliant flavors of crisp lime and fresh lemon blossom extract meet with grapefruit zest. Very lively and tactile.
Lange 2016 Freedom Hill Vineyard Pinot Noir (Willamette Valley)	Freedom Hill Vineyard	93	$70	Willamette Valley, Willamette Valley, Oregon, US	Paul Gregutt	@paulgwine	Contributing Editor	Pinot Noir	Lange	7/1/2019	Red	750 ml	14.2%	Dive into a luscious wine loaded with blueberry fruit, and wrapped in tasty barrel flavors of toast and cigar box. It's beautifully balanced, and further proof that the 2016 vintage is one for the ages at Lange. Aged in 40% new French oak, it's absolutely delicious young but has the potential to continue to improve over the next decade.
Domaine Drouhin Oregon 2016 Laurène Pinot Noir (Dundee Hills)	Laurène	93	$70	Dundee Hills, Willamette Valley, Oregon, US	Paul Gregutt	@paulgwine	Contributing Editor	Pinot Noir	Domaine Drouhin Oregon	7/1/2019	Red	750 ml	14.1%	This is a smoky, silky wine loaded with ripe and juicy blackberry fruit. The percentage of new oak is not disclosed, but there's just the right amount of barrel toast evident in the nose and the flavor. Lovely already, this should age nicely over the next decade.
Daou 2017 Solomon Hills Vineyard Pinot Noir (Santa Maria Valley)	Solomon Hills Vineyard	93	$90	Santa Maria Valley, Central Coast, California, US	Matt Kettmann	@mattkettmann	Contributing Editor	Pinot Noir	Daou	7/1/2019	Red	750 ml	14.5%	Black raspberry aromas are lifted by herbal touches of bay leaf and wild thyme on the nose of this bottling—one of the first Pinot Noirs for the Daou brothers. It's medium bodied on the palate with bright raspberry fruit, herbal touches of marjoram and pencil shavings and a strong acid that carries into the finish.
Larner 2016 Estate Grown Syrah (Ballard Canyon)	Estate Grown	93	$38	Ballard Canyon, Central Coast, California, US	Matt Kettmann	@mattkettmann	Contributing Editor	Syrah	Larner	7/1/2019	Red	750 ml	14.8%	Black currant, violet and dark cocoa aromas are restrained and balanced on the nose of this estate bottling by Michael Larner. The palate packs in purple flower and açaí flavors against a chalky structure.
Dierberg 2016 Drum Canyon Vineyard Pinot Noir (Sta. Rita Hills)	Drum Canyon Vineyard	93	$52	Sta. Rita Hills, Central Coast, California, US	Matt Kettmann	@mattkettmann	Contributing Editor	Pinot Noir	Dierberg	7/1/2019	Red	750 ml	13.9%	This bottling from a vineyard in the heart of the Sta. Rita Hills begins with aromas of earthy soils, dried herbs and bright Bing cherries. The palate's dark red, almost boysenberry fruit tones are both crisp and ripe, wrapped in a rocky, earthy tension that's mouthfilling and bright, finishing on a hint of French toast.
Kelley Fox 2017 Barbie Pinot Blanc (Willamette Valley)	Barbie	93	$35	Willamette Valley, Willamette Valley, Oregon, US	Paul Gregutt	@paulgwine	Contributing Editor	Pinot Blanc	Kelley Fox	7/1/2019	White	750 ml	13%	This looks to be the first vintage for a Kelley Fox Pinot Blanc, and there are two, both sourced from the Freedom Hill vineyard. The Barbie honors Kelley Fox's late mother, a fine artist, whose painting adorns the front label. Fermented in a single acacia puncheon with natural yeast, it's a leesy, textural wine with fresh citrus fruits and a long, racy finish.
Soquel Vineyards 2017 Doctor's Vineyard Pinot Noir (Santa Lucia Highlands)	Doctor's Vineyard	93	$55	Santa Lucia Highlands, Central Coast, California, US	Matt Kettmann	@mattkettmann	Contributing Editor	Pinot Noir	Soquel Vineyards	7/1/2019	Red	750 ml	14.8%	Tangy red-plum aromas meet with peppercorns, coriander and muddy earth on the nose of this bottling. The palate is loaded with exotic Indian spices like cardamom which lift the tangy black-plum and blood orange rind flavors.
Emilio Moro 2015 Vendimia Seleccionada Viñedo La Mira (Ribera del Duero)	Vendimia Seleccionada Viñedo La Mira	93	$44	Ribera del Duero, Northern Spain, Spain	Michael Schachner	@wineschach	Spanish and South American Editor	Tempranillo	Emilio Moro	7/1/2019	Red	750 ml	14%	Heady black fruit and oak aromas don't tread lightly, as this smells of wood grain and cedar along with tobacco and cream. A tough, drawing palate features scraping tannins, while this tastes of frontal oak backed by tea, cola, savory meat and, of course, berry fruit. A long finish is decidedly oaky, but this muscular and massive single-vineyard Tempranillo can handle the wood factor. Drink through 2030.
Parrish Family 2016 Reserve Cabernet Sauvignon (Adelaida District)	Reserve	93	$70	Adelaida District, Central Coast, California, US	Matt Kettmann	@mattkettmann	Contributing Editor	Cabernet Sauvignon	Parrish Family	7/1/2019	Red	750 ml	14.5%	Quite thick in the glass, this reserve bottling by longtime grower David Parrish starts with inviting, delicious aromas of black cherry, pencil shavings and loamy soils. That density is confirmed on the palate, where black-currant flavors meet with hefty oak, milk chocolate, peppercorns and oregano, finishing on vanilla.
Bodegas Franco-Españolas 2011 Royal Reserva (Rioja)	Royal Reserva	93	$34	Rioja, Northern Spain, Spain	Michael Schachner	@wineschach	Spanish and South American Editor	Tempranillo Blend, Tempranillo	Bodegas Franco-Españolas	7/1/2019	Red	750 ml	14%	Aromas of dried plum and cherry are aided by wood spice and vanilla notes. On the palate, this is lively but balanced, with a strong indication that this reserva will age well for another seven to 10 years. Plum, berry and spice flavors are Rioja all the way, while this feels steady on a finish that doesn't waver. Drink through 2028.
Patricia Green Cellars 2017 Weber Vineyard Pinot Noir (Dundee Hills)	Weber Vineyard	93	$48	Dundee Hills, Willamette Valley, Oregon, US	Paul Gregutt	@paulgwine	Contributing Editor	Pinot Noir	Patricia Green Cellars	7/1/2019	Red	750 ml	13.3%	The vines date back to 1983, yielding a young wine with classic texture and elegance. Bright red berry fruit seems gently dusted with sweet spices. It's a lovely wine, with a light hint of mushroom in the finish. The length is impressive—this wine just doesn't quit.
Tardieu-Laurent 2016 Vieilles Vignes Red (Vacqueyras)	Vieilles Vignes	93	$45	Vacqueyras, Rhône Valley, France	Anna Lee C. Iijima		Contributing Editor	Rhône-style Red Blend	Tardieu-Laurent	7/1/2019	Red	750 ml	14.5%	There's a regal, weighty feel to this powerful yet finessed red. Blackberry and cassis flavors are succulent and concentrated, with notes of granite, sandstone and dried mint. It's supple and soft but structured by fine, drying tannins. Immediately approachable, it should hold well through 2026.
Domaine de Fondrèche 2016 Persia Syrah-Mourvèdre (Ventoux)	Persia	93	$30	Ventoux, Rhône Valley, France	Anna Lee C. Iijima		Contributing Editor	Red Blends	Domaine de Fondrèche	7/1/2019	Red	750 ml	N/A	Pristine black cherries are shaded with anise, violet and rose petal on the nose of this gorgeously perfumed blend of 90% Syrah and 10% Mourvèdre. Black-fruit flavors are plush and plump but freshly balanced and fringed by ripe, feathery tannins. This decadent yet elegantly nuanced wine is ready now but should hold through 2026.
null	null	null	null	null	null	null	null	null	null	null	null	null	null	null
Clos Griotte 2017 Momtazi Vineyard Pinot Noir (McMinnville)	Momtazi Vineyard	93	$60	McMinnville, Willamette Valley, Oregon, US	Paul Gregutt	@paulgwine	Contributing Editor	Pinot Noir	Clos Griotte	7/1/2019	Red	750 ml	13%	The grapes from this highly regarded vineyard are in good hands here, fermented in 500 liter puncheons and aged in large barrels. Expressive, brambly red fruits combine with wild herbs in a balanced and detailed young wine that reflects a sure hand at the helm. Winemaker Thibaud Mandet spent 13 years at WillaKenzie prior to starting his own label.
García Figuero 2016 12 Crianza (Ribera del Duero)	12 Crianza	93	$32	Ribera del Duero, Northern Spain, Spain	Michael Schachner	@wineschach	Spanish and South American Editor	Tempranillo	García Figuero	7/1/2019	Red	750 ml	14.6%	Full, smoky blackberry and cassis aromas are concentrated and ripe. Typical of Ribera del Duero, this feels full and flush, with fierce tannins. Blackberry, coffee and chocolate flavors soften a bit on a firm finish that holds off on the hammer. Drink through 2030.
Numanthia 2014 Numanthia (Toro)	Numanthia	93	$60	Toro, Northern Spain, Spain	Michael Schachner	@wineschach	Spanish and South American Editor	Tinta de Toro, Tempranillo	Numanthia	7/1/2019	Red	750 ml	15%	Dense black cherry, chocolate and marzipan aromas convey a rich, ripe style of Toro, which Numanthia always is. Tight and concentrated on the palate, this tastes of savory black fruit and chocolate. An unyielding finish tastes of blackberry and coffee, all framed by tough lasting tannins. Drink through 2032.
Beauregard 2017 Beauregard Ranch Chardonnay (Ben Lomond Mountain)	Beauregard Ranch	93	$60	Ben Lomond Mountain, Central Coast, California, US	Matt Kettmann	@mattkettmann	Contributing Editor	Chardonnay	Beauregard	7/1/2019	White	750 ml	12.5%	Toasted almonds, orange rinds, pan-seared pear and a bit of oak smoke show on the nose of this bottling from a property that's been family-owned since 1945. Green apples, lemon rinds and lemongrass freshness are enhanced by savory sea salt and judicious oak flavors on the palate.
H. Blin 2009 Millesimé Brut (Champagne)	Millesimé Brut	93	$69	Champagne, Champagne, France	Roger Voss	@vossroger	European Editor, Reviews wines from Portugal and France	Champagne Blend, Sparkling	H. Blin	7/1/2019	Sparkling	750 ml	12.5%	Full of white fruits and just hinting at more mature nuttiness, this rich wine is ripe, full and already delicious. Enough freshness gives a crisp aftertaste that's integrated into the wine's generosity. Drink this vintage now.
Alheit 2017 Nautical Dawn Chenin Blanc (Stellenbosch)	Nautical Dawn	93	$63	Stellenbosch, South Africa	Lauren Buzzeo	@laurbuzz	Managing Editor	Chenin Blanc	Alheit	7/1/2019	White	750 ml	13%	There's an immediate spicy, floral character at play here, like ginger mixed with orange blossom and lemon peel tea, alongside notes of spiced pear and musk melon. The palate is fresh and vibrant, with precise acidity that lifts the palate and gives superb cut to the ripe fruit tones. The texture is layered and refined, as waves of fruit, then acidity, then pithy astringency dance across your palate and lead into an enduring, evolving finish.
Brecon Estate 2016 Reserve Syrah (Adelaida District)	Reserve	93	$76	Adelaida District, Central Coast, California, US	Matt Kettmann	@mattkettmann	Contributing Editor	Syrah	Brecon Estate	7/1/2019	Red	750 ml	14.8%	Concentrated aromas of black currant, lilac and burned caramel show on the nose of this rich and oaky bottling. It's thick and brooding on the palate, where rich flavors of cassis, vanilla and charred oak are lifted by elegant tones of violet and leather.
Casa Donoso 2015 Sucesor Blue Limited Release Red (Maule Valley)	Sucesor Blue Limited Release	93	$47	Maule Valley, Chile	Michael Schachner	@wineschach	Spanish and South American Editor	Red Blends	Casa Donoso	7/1/2019	Red	750 ml	13%	Bold black currant and wild berry aromas are made complex by oaky tobacco scents on a nose that's clicking at all levels. In the mouth, this Carmenère blend is lush and powerful, but balanced like a brick house. Blackberry, coffee, vanilla and mocha flavors finish warm and spicy. Forget about bashful; this is a flamboyant red wine to drink through 2026.
Barone Pizzini 2012 Bagnadore Dosaggio Zero (Franciacorta)	Bagnadore Dosaggio Zero	93	$60	Franciacorta, Lombardy, Italy	Kerin O’Keefe	@kerinokeefe	Italian Editor	Sparkling Blend, Sparkling	Barone Pizzini	7/1/2019	Sparkling	750 ml	12.5%	Made with organically grown Chardonnay and Pinot Nero, this stunning sparkler offers intense aromas of toasted bread crust, eucalyptus, mature yellow stone fruit and a whiff of pressed wildflower. The vibrant, bone-dry palate delivers ripe golden apple, juicy grapefruit, ginger and crushed herbs alongside crisp acidity and a refined, lively perlage. It closes on a hazelnut note.
Challen 2016 Zotovich Vineyard Pinot Noir (Sta. Rita Hills)	Zotovich Vineyard	93	$60	Sta. Rita Hills, Central Coast, California, US	Matt Kettmann	@mattkettmann	Contributing Editor	Pinot Noir	Challen	7/1/2019	Red	750 ml	14.5%	Cohesive aromas of rich black cherry, baking spice and a touch of herbs make for a smooth entry to this bottling, in which nothing alone sticks out. There is tannic tension and fresh acidity to the palate, where smashed red fruits and Cinnamon Toast Crunch cereal flavors emerge.
Patricia Green Cellars 2017 Estate Vineyard Sauvignon Blanc (Ribbon Ridge)	Estate Vineyard	93	$29	Ribbon Ridge, Willamette Valley, Oregon, US	Paul Gregutt	@paulgwine	Contributing Editor	Sauvignon Blanc	Patricia Green Cellars	7/1/2019	White	750 ml	13.7%	A stellar example of the variety, this is sourced from 1990 plantings at the estate (note that there is also a less expensive Willamette Valley bottling). Sleek and richly flavored, there's a saline accent under deep citrus and stone fruit, flesh and rind. The depth and penetration compare favorably with top-tier Sancerre.
Domaine Jean-Michel Gerin 2016 Les Grandes Places (Côte Rôtie)	Les Grandes Places	93	$230	Côte Rôtie, Rhône Valley, France	Anna Lee C. Iijima		Contributing Editor	Syrah	Domaine Jean-Michel Gerin	7/1/2019	Red	750 ml	13.5%	Intensely ripe black-cherry and cassis flavors are layered by prominent smoke, char and licorice in this lavish Côte-Rôtie aged 20 months in new oak. Full bodied and intensely ripe, it will need a few years to integrate all its components, but umami notes of dried porcini, bacon fat and charcuterie are enticing. It appeals best to lovers of plush, sweetly spiced Syrah and should drink better from 2023.
Westerly 2016 Fletcher's Red (Happy Canyon of Santa Barbara)	Fletcher's	93	$60	Happy Canyon of Santa Barbara, Central Coast, California, US	Matt Kettmann	@mattkettmann	Contributing Editor	Red Blends	Westerly	7/1/2019	Red	750 ml	15.9%	Aromas of roasted blackberry, coffee, açaí and purple flowers make for a wonderful mix on the nose of this red blend. There's a hint of sweet caramel cream on the palate alongside blackberry foam, lifted by pinches of thyme and other roasting herbs. It is a complete and powerful red wine.
Arrochela & Camizão 2017 Sem Igual Ramadas Metal White (Vinho Verde)	Sem Igual Ramadas Metal	93	$40	Vinho Verde, Portugal	Roger Voss	@vossroger	European Editor, Reviews wines from Portugal and France	Portuguese White	Arrochela & Camizão	7/1/2019	White	750 ml	13.5%	From pergola-trained vines as old as 70 years old, this wine is rich, textured with spice and filled with tropical fruit and almond flavors. It is concentrated and full in the mouth, ready to drink now.
