Title	Designation	Points	Price	Appellation	TasterName	TasterTwitterHandle	TasterTitle	Variety	Winery	DatePublished	Category	BottleSize	Alcohol	Description
Waters 2014 Tremelo Red (Washington)	Tremelo	94	$32	Washington, Washington Other, Washington, US	Sean P. Sullivan	@wawinereport	Contributing Editor	Rhône-style Red Blend	Waters	7/1/2019	Red	750 ml	13.7%	Syrah from Old Stones Vineyard makes up three-quarters of the blend of this wine, with the balance of Grenache from Olsen Vineyard. The aromas are outrageous, with notes of fire pit, freshly peeled tangerine, potpourri, gravel, herb and peat. Pillowy-soft fruit and an olive brine note extend on the finish. The textured mouthfeel only heightens the appeal.
Ventisquero 2014 Vertice Apalta Vineyard Carmenère-Syrah (Colchagua Valley)	Vertice Apalta Vineyard	94	$30	Colchagua Valley, Chile	Michael Schachner	@wineschach	Spanish and South American Editor	Red Blends	Ventisquero	7/1/2019	Red	750 ml	14.5%	Ventisquero may make more expensive wines but none are better than this version of Vertice Carmenère-Syrah, from the winery's best slopes at Apalta in Colchagua. Foresty aromas of cool underbrush, mint, menthol and blackberry feed into a palate with steely acidity, which this full-bodied red needs. Cassis, blackberry, mocha and tobacco flavors wind down on an appealingly oaky finish. Drink through 2030.
Ovum 2017 Sinnerman Gewürztraminer (Rogue Valley)	Sinnerman	94	$45	Rogue Valley, Southern Oregon, Oregon, US	Paul Gregutt	@paulgwine	Contributing Editor	Gewürztraminer	Ovum	7/1/2019	White	500 ml	15.5%	Again sourced from the Gerber Vineyard's 40-year-old vines, this has achieved exceptional ripeness and concentration (15.5% alcohol) yet retains its ethereal perfume and sacrifices no details. It was native yeast fermented in 500-liter acacia puncheons, then aged for nine months on the lees. Baby powder, lilac and chamomile aromas set up this dry, intensely pungent wine with mixed citrus fruit flavors.
Domaine Drouhin Oregon 2016 Édition Limitée Pinot Noir (Dundee Hills)	Édition Limitée	94	$85	Dundee Hills, Willamette Valley, Oregon, US	Paul Gregutt	@paulgwine	Contributing Editor	Pinot Noir	Domaine Drouhin Oregon	7/1/2019	Red	750 ml	14.1%	Tucked into the DDO lineup between the Laurène and Louise reserves, this has an earthy character that softens the mouthfeel and opens up the midpalate. Cherry pastry, mocha and sandalwood highlights add interest and detail, and this is the 2016 to drink first while the others get a bit more bottle age.
Cartago 2014 Paraje del Pozo (Toro)	Paraje del Pozo	94	$170	Toro, Northern Spain, Spain	Michael Schachner	@wineschach	Spanish and South American Editor	Tinta de Toro, Tempranillo	Cartago	7/1/2019	Red	750 ml	14.5%	Initially, this big-time Tempranillo from Bodegas San Román smells lactic and chocolaty, with a hint of marshmallow to go with black cherry and blackberry fruit. On the palate, this is rugged and tough, something you can embrace but can't avoid. Black cherry, cassis and dark plum flavors finish with cocoa notes, and the more air this sees the better it will perform. Drink through 2030.
Ebner-Ebenauer 2017 Hermanschachern Grüner Veltliner (Niederösterreich)	Hermanschachern	94	N/A	Niederösterreich, Austria	Anne Krebiehl MW	@AnneInVino	Contributing Editor	Grüner Veltliner	Ebner-Ebenauer	7/1/2019	White	750 ml	13%	A very subtle nose gives little away. It is on the palate that the fizzing, peppery, salty and savory nature breaks through. This is vivid and slender, energetic and bright. Lime zest and white pepper make for a tingling, moreish and lip-smacking finale.
Beekeeper Cellars 2016 Montecillo Vineyard Zinfandel (Sonoma County)	Montecillo Vineyard	94	$65	Sonoma County, Sonoma, California, US	Virginie Boone	@vboone	Contributing Editor	Zinfandel	Beekeeper Cellars	7/1/2019	Red	750 ml	14.5%	Blended with 5% Petite Sirah and then aged 15 months in all French oak, this is a beautifully made and fun wine to drink, earthy in forest mushroom and grilled meat. The vineyard sits at 1,500 feet in elevation and contributes sizable tannin weight, a worthy companion to the ripe richness of the blueberry cobbler and black pepper at its core.
Domaine Drouhin Oregon 2017 Édition Limitée Chardonnay (Dundee Hills)	Édition Limitée	94	$65	Dundee Hills, Willamette Valley, Oregon, US	Paul Gregutt	@paulgwine	Contributing Editor	Chardonnay	Domaine Drouhin Oregon	7/1/2019	White	750 ml	13.9%	The winery's reserve-level cuvée is sourced from the estate vineyard, same as the Arthur, but here the presence of new oak is more forceful, the fruit a bit richer, and the impact of phenolic overtones more noticeable. It's a young, pungent wine that should benefit from additional bottle age. Drink 2021–2028.
21 Grams 2014 Red (Columbia Valley (WA))	null	94	$125	Columbia Valley (WA), Columbia Valley, Washington, US	Sean P. Sullivan	@wawinereport	Contributing Editor	Bordeaux-style Red Blend	21 Grams	7/1/2019	Red	750 ml	14.5%	Cabernet Sauvignon from esteemed Cold Creek Vineyard makes up the backbone of this wine. Intoxicating aromas of assorted dried herbs, graphite, spice, tea leaf, coffee and black cherry are followed by tightly wound dark fruit flavors. The rich flavors show sophistication, layering and depth, with enough acid and tannin structure for 20-plus years of enjoyment. An extended finish only heightens the impression. It's a stunner that overwhelms on expressiveness rather than sheer strength. Best after 2025.
Dierberg 2016 Dierberg Vineyard Chardonnay (Santa Maria Valley)	Dierberg Vineyard	94	$32	Santa Maria Valley, Central Coast, California, US	Matt Kettmann	@mattkettmann	Contributing Editor	Chardonnay	Dierberg	7/1/2019	White	750 ml	13.2%	The fascinating nose of this bottling is driven by wet stone, yet it also touches on orange rinds, fresh chives, lemongrass balm and a nearly basil-like aromatic without the green spice. It's lively on the palate with flint and crushed stone, showing very fresh and acid-driven flavors of lemon and ash, riding a firm tension through the sip.
Ebner-Ebenauer 2016 Black Edition Grüner Veltliner (Niederösterreich)	Black Edition	94	N/A	Niederösterreich, Austria	Anne Krebiehl MW	@AnneInVino	Contributing Editor	Grüner Veltliner	Ebner-Ebenauer	7/1/2019	White	750 ml	13%	Something heady, something fresh, something green and something vigorous rises from the glass alongside the creaminess of oak. The milky balm of aloe vera is combined with ferns, fresh hay and tingling white pepper. There is an edge of vanilla, too, complemented by spiky lemon. Layers of flavor shimmer to present a picture of concentrated, buffered but fresh savoriness. Drink now–2035.
Lombard et Cie NV Avize Grand Cru Lieu-Dit Chemin de Flavigny Brut Nature Chardonnay (Champagne)	Avize Grand Cru Lieu-Dit Chemin de Flavigny Brut Nature	94	$100	Champagne, Champagne, France	Roger Voss	@vossroger	European Editor, Reviews wines from Portugal and France	Chardonnay	Lombard et Cie	7/1/2019	Sparkling	750 ml	12.5%	A limited-production wine from the from the Côte des Blancs. It is tightly textured, very crisp, mineral and fresh. Bright citrus and green-apple flavors will soften as the wine matures. It should not be drunk before 2021.
Latta 2015 Dana Dibble Freewater Rocks Vineyard Syrah (Walla Walla Valley (WA))	Dana Dibble Freewater Rocks Vineyard	94	$45	Walla Walla Valley (WA), Columbia Valley, Washington, US	Sean P. Sullivan	@wawinereport	Contributing Editor	Syrah	Latta	7/1/2019	Red	750 ml	14.1%	This is the winery's first offering of Syrah. There's no mistaking the fruit comes from The Rocks District, with the area's hallmark aromas of olive, fire pit, charcuterie, plum, dried herb, orange peel and parsley that are intense but still show a sense of subtlety. The palate is textured and rich but still in balance, full of fruit and savory flavors. An insanely long, 30-second-plus finish caps it off. One of the wines of the vintage. Best after 2021.
Quinta de Soalheiro 2017 Reserva Alvarinho Alvarinho (Vinho Verde)	Reserva Alvarinho	94	$40	Vinho Verde, Portugal	Roger Voss	@vossroger	European Editor, Reviews wines from Portugal and France	Alvarinho, Albariño	Quinta de Soalheiro	7/1/2019	White	750 ml	13%	Fermented and aged in oak, this is very different take on Alvarinho. The wood softens to acidity, which instead emphasizes the creaminess and ripeness of the rich fruit. It's ready to drink, although it will certainly age.
Donum 2016 Year of the Monkey Reserve Single Vineyard Pinot Noir (Russian River Valley)	Year of the Monkey Reserve Single Vineyard	94	$100	Russian River Valley, Sonoma, California, US	Virginie Boone	@vboone	Contributing Editor	Pinot Noir	Donum	7/1/2019	Red	750 ml	14.8%	This is a tightly wound, forceful and weighty wine that displays juicy black cherry and blackberry tones, complemented by firm, textured tannins and accents of clove and tobacco. It is an ageworthy style that should do well in the cellar. Enjoy 2026–2031.
Freeman 2016 Akiko's Cuvée Pinot Noir (Sonoma Coast)	Akiko's Cuvée	94	$75	Sonoma Coast, Sonoma, California, US	Jim Gordon	@gordone_cellars	Contributing Editor	Pinot Noir	Freeman	7/1/2019	Red	750 ml	14.1%	This is a vibrant, fruit-forward and firmly textured wine that offers fresh red- and black-cherry aromas accented by spice and earth. Medium to full in body, the wine has a luxurious mouthfeel and lingering finish. Considering its concentration and good structure, it will be best after 2023.
Roar 2017 Rosella's Vineyard Pinot Noir (Santa Lucia Highlands)	Rosella's Vineyard	94	$62	Santa Lucia Highlands, Central Coast, California, US	Matt Kettmann	@mattkettmann	Contributing Editor	Pinot Noir	Roar	7/1/2019	Red	750 ml	14.8%	Lighter in the glass, this bottling is a somewhat more delicate style than usual for the Franscioni family, but just as delicious if not more so depending on preference. Aromas of raspberry, pomegranate and wild thyme lead into a palate that's loaded with strawberry, white pepper and bay leaf, finishing on vanilla cream.
Valdicava 2013 Madonna del Piano Riserva (Brunello di Montalcino)	Madonna del Piano Riserva	94	$300	Brunello di Montalcino, Tuscany, Italy	Kerin O’Keefe	@kerinokeefe	Italian Editor	Sangiovese	Valdicava	7/1/2019	Red	750 ml	14%	Earthy aromas of wild berry, new leather, truffle and exotic spice emerge from the glass. The concentrated, vibrant palate delivers dried black cherry, licorice, tobacco and black pepper alongside fine-grained tannins. Drink 2022–2029.
Pali 2016 Pali Vineyard Clone 2A Pinot Noir (Sta. Rita Hills)	Pali Vineyard Clone 2A	94	$69	Sta. Rita Hills, Central Coast, California, US	Matt Kettmann	@mattkettmann	Contributing Editor	Pinot Noir	Pali	7/1/2019	Red	750 ml	14.3%	Intense black raspberry fruit meets with sagebrush, bay leaf and peppercorn on the extremely complex and inviting nose of this clonal selection. The palate is taut and wound up with bright and expressive red-fruit flavors that are lifted with pinches of cinnamon, marjoram and orange rind.
Lange 2017 Estate Chardonnay (Dundee Hills)	Estate	94	$65	Dundee Hills, Willamette Valley, Oregon, US	Paul Gregutt	@paulgwine	Contributing Editor	Chardonnay	Lange	7/1/2019	White	750 ml	13.4%	A big-shouldered, bold-flavored, impactfully dense style mixes ripe apple, Meyer lemon and a taste of pineapple in a wine with exceptional concentration. Aged in neutral wood, it picks up just a gentle lick of vanilla winding through the finish. Decant this wine, as it has the depth to reward extra-long aeration.
Wohlmuth 2017 Ried Edelschuh Riesling (Südsteiermark)	Ried Edelschuh	94	$22	Südsteiermark, Austria	Anne Krebiehl MW	@AnneInVino	Contributing Editor	Riesling	Wohlmuth	7/1/2019	White	750 ml	13%	All manner of fruit rises gently from the glass. There is the obligatory citrus but that plays around ripe peach, and tropical passion fruit, with its lemon and tangerine charm. The body is slender, sinuous and juicy, with ripe and mild but pure lemon freshness. A hint of creaminess is also present. This is an elegant and smooth Riesling with layers and layers of fruit. Drink 2020–2030.
Brooks Note 2016 Pinot Noir (Marin County)	null	94	$36	Marin County, North Coast, California, US	Jim Gordon	@gordone_cellars	Contributing Editor	Pinot Noir	Brooks Note	7/1/2019	Red	750 ml	13.9%	Bold, ripe and concentrated, this full-bodied wine is one of the bigger and more robust Pinot examples out there. Without obvious oakiness, it shows abundant flavors of black cherry, cranberry and sour cherry that are pure and focused. It shows excellent depth, ample acidity and a firm tannic that will help it improve with age. Best after 2023.
Lange 2016 Lange Estate Vineyard Pinot Noir (Dundee Hills)	Lange Estate Vineyard	94	$70	Dundee Hills, Willamette Valley, Oregon, US	Paul Gregutt	@paulgwine	Contributing Editor	Pinot Noir	Lange	7/1/2019	Red	750 ml	13.9%	The estate vineyard, planted in the late 1980s, is at optimal maturity, as this spicy, expressive and thoroughly captivating wine demonstrates. Lifted raspberry and black cherry fruit, aromatic and perfectly ripened, benefits from judiciously used new oak (35%), which adds toasty coffee flavors to the finish. There's a light touch of clean earth and a spicy pine scent underscoring the lovely fruit.
Slyd 2016 The Show Syrah (Happy Canyon of Santa Barbara)	The Show	94	$38	Happy Canyon of Santa Barbara, Central Coast, California, US	Matt Kettmann	@mattkettmann	Contributing Editor	Syrah	Slyd	7/1/2019	Red	750 ml	14.5%	Aromas of black cherry, cracked peppercorn and smoke make for a delicious combination on the nose of this bottling, one of the few Syrahs from Happy Canyon. The palate combines flavors of roasted pork, boysenberry and a dusting of black pepper to present a complete picture of the grape.
Caraccioli 2013 Méthode Champenoise Brut Rosé Sparkling (Santa Lucia Highlands)	Méthode Champenoise Brut Rosé	94	$60	Santa Lucia Highlands, Central Coast, California, US	Matt Kettmann	@mattkettmann	Contributing Editor	Sparkling Blend, Sparkling	Caraccioli	7/1/2019	Sparkling	750 ml	12%	A pleasing shade of pale yellowish-pink in the glass, this sparkler starts with aromas of chalk, wet cement, nectarine and grapefruit pith. The bubbles are precise on the palate, which snaps with a fresh tangerine rind flavor, but also offers a bit more broad orchard fruit flavors as well.
Dutton-Goldfield 2016 Emerald Ridge Vineyard Pinot Noir (Green Valley)	Emerald Ridge Vineyard	94	$68	Green Valley, Sonoma, California, US	Virginie Boone	@vboone	Contributing Editor	Pinot Noir	Dutton-Goldfield	7/1/2019	Red	750 ml	13.5%	From an east-facing knoll in the heart of the appellation, this is an earthy red showing barrel oak and tea accents lifted by bright acidity and ongoing freshness. Blueberry, pomegranate and rhubarb flavors mingle around layered tannins and a light body. The texture is taut yet lush, with a savory baking-spice component.
Tardieu-Laurent 2016 Côte Rôtie	null	94	$92	Côte Rôtie, Rhône Valley, France	Anna Lee C. Iijima		Contributing Editor	Rhône-style Red Blend	Tardieu-Laurent	7/1/2019	Red	750 ml	12.5%	This beautifully structured Côte-Rôtie balances ripe, concentrated black-cherry and plum flavors against elegant notes of fresh thyme, rosemary and bacon. It's penetrating and freshly fruited but vibrantly balanced in acidity. The finish is long, edged by finely integrated but gripping tannins.
Dutton-Goldfield 2016 Redwood Ridge Pinot Noir (Sonoma Coast)	Redwood Ridge	94	$62	Sonoma Coast, Sonoma, California, US	Virginie Boone	@vboone	Contributing Editor	Pinot Noir	Dutton-Goldfield	7/1/2019	Red	750 ml	14.4%	From a site also known as Putnum Vineyard, six miles from the Pacific Ocean in Annapolis, this is a gorgeously layered and herbal wine, fresh in flavors of black cherry and tangerine. Dense and lush in feel, it unwinds slowly with a brambly, savory nature. Enjoy 2026–2030.
Patricia Green Cellars 2017 Olenik Vineyard Wadensvil Block Pinot Noir (Chehalem Mountains)	Olenik Vineyard Wadensvil Block	94	$48	Chehalem Mountains, Willamette Valley, Oregon, US	Paul Gregutt	@paulgwine	Contributing Editor	Pinot Noir	Patricia Green Cellars	7/1/2019	Red	750 ml	13.9%	This clone seems to be a perfect fit in this location, yielding robust berry fruit further defined with sappy acids. Juicy citrus flavors underscore the berries, and despite its youth it's a tangy and quite appealing wine, with another decade of aging potential.
null	null	null	null	null	null	null	null	null	null	null	null	null	null	null
Castelnau NV Hors Categorie CCF 2067 Extra Brut (Champagne)	Hors Categorie CCF 2067 Extra Brut	94	$159	Champagne, Champagne, France	Roger Voss	@vossroger	European Editor, Reviews wines from Portugal and France	Champagne Blend, Sparkling	Castelnau	7/1/2019	Sparkling	750 ml	12.5%	Aged in wood, this wine has plenty of toastiness. It is dry, spicy with peppered white-fruit flavors that are crisp with plenty of acidity. It needs to age further, so wait to drink this bottling until 2021.
Delas Frères 2016 Les Bressards (Hermitage)	Les Bressards	94	$257	Hermitage, Rhône Valley, France	Anna Lee C. Iijima		Contributing Editor	Rhône-style Red Blend	Delas Frères	7/1/2019	Red	750 ml	14%	While decadently fruit-forward for Hermitage, this rich, unctuous wine maintains the region's characteristic minerality and earthen complexities. Ripe black-cherry and plum flavors are warmed by spicy notes of anise and caramelized sugar along with fine, smooth tannins. It's a ripe, rather potent expression of Syrah but finessed enough to improve through 2030 and likely hold further.
Beauregard 2017 Bald Mountain Vineyard Sand Hill Chardonnay (Ben Lomond Mountain)	Bald Mountain Vineyard Sand Hill	94	$65	Ben Lomond Mountain, Central Coast, California, US	Matt Kettmann	@mattkettmann	Contributing Editor	Chardonnay	Beauregard	7/1/2019	White	750 ml	N/A	There is a sharply mineral focus to the nose of this bottling, which shows aromas of wet gravel alongside lemon peel, lemon blossoms and a touch of ripe nectarine. It's very grippy on the palate, where chalky texture and flavors unveil lemon pith, river water and kumquat flavors.
Lombard et Cie NV Verzenay Grand Cru Lieu-Dit Les Corettes Brut Nature Pinot Noir (Champagne)	Verzenay Grand Cru Lieu-Dit Les Corettes Brut Nature	94	$100	Champagne, Champagne, France	Roger Voss	@vossroger	European Editor, Reviews wines from Portugal and France	Pinot Noir	Lombard et Cie	7/1/2019	Sparkling	750 ml	12.5%	This limited-production wine comes from a parcel in Verzenay on the Montagne de Reims. Pure Pinot Noir gives weight, texture and almost a hint of tannins. As a Brut Nature, the wine is bone dry and will be best with a few years in bottle. Drink from 2020.
TW Ferm Co. 2015 Straight Cab Cabernet Sauvignon (Paso Robles)	Straight Cab	94	$64	Paso Robles, Central Coast, California, US	Matt Kettmann	@mattkettmann	Contributing Editor	Cabernet Sauvignon	TW Ferm Co.	7/1/2019	Red	750 ml	14.2%	Aromas of roasted cocoa, blackberry, loamy earth and dried herb show on the nose of this small-batch bottling, of which only 43 cases were made. There is a great vitality on the palate, where flavors of dark strawberry and black cherry meet with mocha, caramel and hoisin. The structure is firm with solid acidity.
Larner 2014 Metamorphic Syrah (Ballard Canyon)	Metamorphic	93	$100	Ballard Canyon, Central Coast, California, US	Matt Kettmann	@mattkettmann	Contributing Editor	Syrah	Larner	7/1/2019	Red	750 ml	14.9%	Lilacs, boysenberry, cracked pepper, lavender and toasty oak aromas show on the nose of this bottling, one of Michael Larner's geologic studies. It's lively on the palate with purple flowers, elderberry juice and peppercorn flavors, proving expressive and elegant.
Challen 2016 Peake Ranch Vineyard Pinot Noir (Sta. Rita Hills)	Peake Ranch Vineyard	94	$60	Sta. Rita Hills, Central Coast, California, US	Matt Kettmann	@mattkettmann	Contributing Editor	Pinot Noir	Challen	7/1/2019	Red	750 ml	14.2%	There is an earthy hearty core that seems to come from this new vineyard on the eastern edge of the Sta. Rita Hills, and it shows well in this bottling. Aromas of turned soil and porky game meet with pepper, thyme and strong red fruit on the nose, while the palate offers exotic cherry, mulberry, tangy herbs and more animal tones.
Château La Nerthe 2015 Cuvée des Cadettes Red (Châteauneuf-du-Pape)	Cuvée des Cadettes	94	$155	Châteauneuf-du-Pape, Rhône Valley, France	Anna Lee C. Iijima		Contributing Editor	Rhône-style Red Blend	Château La Nerthe	7/1/2019	Red	750 ml	14.5%	There's a rich, decadent core of black cherry, plum and strawberry in this wine, but it's layered with piquant accents of anise, smoke, earth and fur. It's richly fruity but freshly composed and fringed by fine, persistent tannins. Ready to drink now, it should improve through 2030.
Caraccioli 2016 Escolle Vineyard Chardonnay (Santa Lucia Highlands)	Escolle Vineyard	93	$35	Santa Lucia Highlands, Central Coast, California, US	Matt Kettmann	@mattkettmann	Contributing Editor	Chardonnay	Caraccioli	7/1/2019	White	750 ml	14.2%	From a winery focused primarily on sparkling wine comes this compelling Chardonnay, which offers aromas of Meyer lemon pith, fresh lime balm, white flowers and a touch of almond. The palate is tense and fresh, somehow both full and crisp, delivering flavors of plumeria, lily and citrus.
Joyce 2017 Submarine Canyon Pinot Noir (Monterey)	Submarine Canyon	93	$25	Monterey, Central Coast, California, US	Matt Kettmann	@mattkettmann	Contributing Editor	Pinot Noir	Joyce	7/1/2019	Red	750 ml	13.5%	This is a great entry-level wine from Russell Joyce, starting with aromas of candied Bing cherry, earthy forest floor and umami-laced shiitake mushrooms. The palate is bright and snappy with raspberry, marjoram, bay leaf and pine needle flavors, framed by taut tannins and brilliant acidity.
Quinta de Foz de Arouce 2015 Vinhas Velhas de Santa Maria Baga (Beira Atlantico)	Vinhas Velhas de Santa Maria	94	$70	Beira Atlantico, Portugal	Roger Voss	@vossroger	European Editor, Reviews wines from Portugal and France	Baga, Portuguese Red	Quinta de Foz de Arouce	7/1/2019	Red	750 ml	14%	Produced from old Baga vines, this is an immensely powerful and impressive wine. Its richness comes through in the dark tannins as well as bold black fruits. It is a dense wine still with great potential. Drink from 2020.
null	null	null	null	null	null	null	null	null	null	null	null	null	null	null
Domaine Jean-Michel Gerin 2016 La Landonne (Côte Rôtie)	La Landonne	94	$385	Côte Rôtie, Rhône Valley, France	Anna Lee C. Iijima		Contributing Editor	Syrah	Domaine Jean-Michel Gerin	7/1/2019	Red	750 ml	13.5%	Intensely penetrating layers of sweet spice, vanilla and smoke lend an unabashedly flashy demeanor to this unusually opulent Northern Rhône Syrah. Matured in 100% new oak, it will need some time in the cellar to allow its core of ripe blackberry and plum flavors plus nuances of mint and bramble to peek through. It's quite decadent now but should ease up a bit from 2023.
Jaffurs 2017 Stolpman Vineyard Roussanne (Ballard Canyon)	Stolpman Vineyard	93	$30	Ballard Canyon, Central Coast, California, US	Matt Kettmann	@mattkettmann	Contributing Editor	Roussanne	Jaffurs	7/1/2019	White	750 ml	13.5%	Roussanne is one of the white wines that will age for eons when done right, and this is a prime example. Restrained aromas of honey, almond, orange rind and brioche lead into a palate that's rich yet structured with flavors of creamy milk toast, marzipan, orange and hazelnut. Drink now through 2032.
Ann Albert 2017 Martian Ranch Gamay Noir (Santa Barbara County)	Martian Ranch	93	$34	Santa Barbara County, Central Coast, California, US	Matt Kettmann	@mattkettmann	Contributing Editor	Gamay Noir, Gamay	Ann Albert	7/1/2019	Red	750 ml	13.4%	This bottling by Talley winemaker Eric Johnson of a grape that shows incredible promise in this region slowly opens on the nose with aromas of fresh cranberry, wet gravel, lanolin and tart red plum. It's tightly wound on the palate, and spread its wings over the hours and days that it's opened into flavors of bright red currant, rainy cement and crushed stone.
Domaine de la Bégude 2016 La Brulade Red (Bandol)	La Brulade	94	$84	Bandol, Provence, France	Roger Voss	@vossroger	European Editor, Reviews wines from Portugal and France	Red Blends	Domaine de la Bégude	7/1/2019	Red	750 ml	14%	This wine is produced from organic grapes, wood aged for 18 months and powered by ripe tannins and a balanced structure that molds rich fruit and acidity into an intense structure. Drink from 2023.
Domaine Drouhin Oregon 2016 Louise Pinot Noir (Dundee Hills)	Louise	94	$100	Dundee Hills, Willamette Valley, Oregon, US	Paul Gregutt	@paulgwine	Contributing Editor	Pinot Noir	Domaine Drouhin Oregon	7/1/2019	Red	750 ml	14.1%	This is the top of the line at DDO, an aromatic, almost sultry reserve barrel selection. The percentage of new oak seems to be higher than in the other 2016s, with brilliant cherry fruit matching the sweet toast. Best guess is tuck a few bottles away and start drinking in the mid-2020s; from there it could go another decade.
Elias Mora 2012 2V Premium (Toro)	2V Premium	93	$140	Toro, Northern Spain, Spain	Michael Schachner	@wineschach	Spanish and South American Editor	Tinta de Toro, Tempranillo	Elias Mora	7/1/2019	Red	750 ml	15%	Jammy blackberry, prune and chocolate aromas comprise a prototypical Toro nose. Raw tannins along with fresh acidity make for an intense palate that's nowhere near at peak, while this tastes of black fruits, toasty oak, chocolate and baking spices. On the finish, a residual oak flavor and related spice notes along with hard tannins suggest that you don't rush this. Drink through 2032.
